"601081","0","1","2","0","0","764","724","0","1","1","1","0","0","0","0","0","0","False","False","False","ただ目の前のことに集中して、<hex:02100103>自分が満足する品を生涯作り続けてることに命を燃やす……<hex:02100103>それがオレの生きる喜びよ！","っしゃあ！<hex:02100103>今日も張り切って仕事してやンぜぇぇぇ！！","0"
"601080","0","1","2","0","0","950","0","0","1","1","1","0","0","0","0","0","0","False","False","False","よく無事に帰ってきたじゃねぇか！<hex:02100103>さっすがこのオレが目を付けただけあるぜ！","こっちは今、復旧の仕事がいろいろ舞い込ンできてて、<hex:02100103>しばらくまともに寝られそうにねぇがな……ダッハッハ！","0"
"601083","0","1","2","0","0","4236","0","0","1","1","1","0","0","0","0","0","0","False","False","False","そんな……。<hex:02100103>機械兵が……また暴走してるの……？","0","0"
"601082","0","1","2","0","0","764","0","0","1","1","1","0","0","0","0","0","0","False","False","False","エレクトロープの操作方法は、だいぶわかるようになったんだ！<hex:02100103>シェールと一緒に頑張るからね！","0","0"
"601085","0","1","2","0","0","950","0","0","1","1","1","0","0","0","0","0","0","False","False","False","なあなあ、聞いてくれよ！<hex:02100103>前に「荒野の夜明け団」を抜けてった奴らが、<hex:02100103>続々と戻ってきてるんだ！","ウィフーテに騙されて悪事に手を染めちまった奴らも、<hex:02100103>ちゃんと罪を償ったら、また俺様たちと一緒に活動したいってよ。<hex:02100103>へへっ、なんか嬉しいよな！","0"
"601084","0","1","2","0","0","764","0","0","1","1","1","0","0","0","0","0","0","False","False","False","みんなのこと信じてるよ。<hex:02100103>僕もこっちで、街のみんなを励まし続けるからね！","0","0"
"601087","0","1","2","0","0","764","0","0","1","1","1","0","0","0","0","0","0","False","False","False","「荒野の夜明け団」は、自警隊と連携することにしたんだよ。<hex:02100103>僕らが町で定期的に開かれる会合に呼ばれるなんて、<hex:02100103>ちょっと前までは想像もつかなかったな。","0","0"
"601086","0","1","2","0","0","763","0","0","1","1","1","0","0","0","0","0","0","False","False","False","デコワの奴、すんごい張り切ってるでしょ？<hex:02100103>ウィフーテの騒動で抜けてった仲間が、戻ってきて嬉しいんだよ。","もちろんアタシも嬉しいよ！<hex:02100103>射撃の特訓を続けたおかげで腕も上がったし、<hex:02100103>もうウィフーテみたいなクズには屈しないんだから。","0"
"601073","0","1","2","0","0","764","0","0","1","1","1","0","0","0","0","0","0","False","False","False","ヤ・シュトラさんから事の次第は聞いています。<hex:02100103>本当に、ありがとうございました……。","0","0"
"601072","0","1","2","0","0","4218","0","0","1","1","1","0","0","0","0","0","0","False","False","False","僕はいつも誰かを見送る立場で、<hex:02100103>大切な人たちの帰りを待つことしかできません。<hex:02100103>無事に帰ってきてくださいね、絶対に……。","0","0"
"601075","0","1","2","0","0","764","0","0","1","1","1","0","0","0","0","0","0","False","False","False","暴走したエレクトロープ機器はどうにか落ち着いたンで、<hex:02100103>メンバーの武器をメンテナンスしておいたぜ。<hex:02100103>何事も備えあれば患いなしってなぁ！","0","0"
"601074","0","1","2","0","0","763","0","0","1","1","1","0","0","0","0","0","0","False","False","False","カフキワさんもジオードもいなくなってしまいましたから、<hex:02100103>今は僕がオブリビオンのみんなを指揮してるんですよ。<hex:02100103>リーダーなんて、全然柄じゃないんですけどね。","とはいえ、国が平和になれば組織の役目も終わり。<hex:02100103>落ち着いたら……いえ、受け止める覚悟ができたら、<hex:02100103>僕もこっそり記憶返還をしてみようと思います。","0"
"601077","0","1","2","0","0","4219","0","0","1","1","1","0","0","0","0","0","0","False","False","False","……ジオードの銃が帰ってきたんだけどよ、<hex:02100103>弾は空っぽで、銃身も焼き付いていたんだ。<hex:02100103>あいつは戦ったんだな、最期の瞬間まで。","0","0"
"601076","0","1","2","0","0","5665","0","0","1","1","1","0","0","0","0","0","0","False","False","False","おいおい、いったい何が起きてるってンだよ……！","0","0"
"601079","0","1","2","0","0","1071","0","0","1","1","1","0","0","0","0","0","0","False","False","False","おう、油断はすンじゃねぇぞ。<hex:02100103>最後までパッションでいけ、パッションでよぉ！","0","0"
"601078","0","1","2","0","0","4219","764","0","1","1","1","0","0","0","0","0","0","False","False","False","ケッ、街の連中までシケた面しやがってよ。<hex:02100103>無心で手を動かしてりゃ、余計なことを考えなくて済む。","……オレはそれで今までやってきたンだよ。<hex:02100103>さあて、仕事だ仕事！","0"
