"600892","0","1","2","0","0","1041","0","0","1","1","1","0","0","0","0","0","0","False","False","False","あんたがこの国のために戦ってくれたんだってな？<hex:02100103>俺のカスタムみてえに、最高にイケてる<hex:02081FE905FF0DE5A789E381A1E38283E38293FF0DE58584E381A1E38283E3829303>だぜ！","0","0"
"600895","0","1","2","0","0","4219","0","0","1","1","1","0","0","0","0","0","0","False","False","False","レゾリューションで流れている映像を見てから、<hex:02100103>私もう、ずっと心がざわざわしていて……<hex:02100103>ああ、こんなときこそアルコールを飲んで忘れたいわね。","0","0"
"600894","0","1","2","0","0","757","0","0","1","1","1","0","0","0","0","0","0","False","False","False","……黒いレギュレーターの件で気づいたんだ。<hex:02100103>俺には永遠の命なんかよりも、<hex:02100103>シェイカーを振る毎日こそ、かけがえのないものだってな。","0","0"
"600881","0","0","0","0","0","0","0","0","0","0","0","0","0","0","0","0","0","False","False","False","","",""
"600880","0","0","0","0","0","0","0","0","0","0","0","0","0","0","0","0","0","False","False","False","","",""
"600883","0","0","0","0","0","0","0","0","0","0","0","0","0","0","0","0","0","False","False","False","","",""
"600882","0","0","0","0","0","0","0","0","0","0","0","0","0","0","0","0","0","False","False","False","","",""
"600885","0","0","0","0","0","0","0","0","0","0","0","0","0","0","0","0","0","False","False","False","","",""
"600884","0","0","0","0","0","0","0","0","0","0","0","0","0","0","0","0","0","False","False","False","","",""
"600887","0","0","0","0","0","0","0","0","0","0","0","0","0","0","0","0","0","False","False","False","","",""
"600886","0","0","0","0","0","0","0","0","0","0","0","0","0","0","0","0","0","False","False","False","","",""
"600905","0","1","1","0","0","9072","0","0","1","1","1","605","0","0","0","0","0","False","False","False","妻が治療を終えて戻ってきたよ。<hex:02100103>最初はかなり精神的にも参っていたけど、<hex:02100103>今は落ち着いて、笑顔を見せてくれるようになったんだ。","0","0"
"600904","0","1","1","0","0","9072","0","0","1","1","1","625","0","0","0","0","0","False","False","False","妻が心を失くしたかのように、茫然自失になって……。<hex:02100103>今は医療施設に隔離されているんだが、<hex:02100103>いったい彼女はどうなってしまうのか……。","0","0"
"600907","0","1","1","0","0","9072","0","0","1","1","1","0","0","0","0","0","0","False","False","False","もうレギュレーターなんて、こりごりだと思っていたが、<hex:02100103>悩んだ末に、記憶返還の申請に来たんだ。<hex:02100103>これからは死を受け入れて生きたいと思うようになったのさ。","0","0"
"600906","0","1","1","0","0","765","0","0","1","1","1","0","0","0","0","0","0","False","False","False","祈りを捧げれば死を避けられる……。<hex:02100103>あの映像の女神像はスフェーン様に似ていた……<hex:02100103>きっと私たちを救ってくださるんだ……。","0","0"
"600909","0","1","1","0","0","9072","0","0","1","1","1","0","0","0","0","0","0","False","False","False","もうダメだと思ったときに、スフェーン様の放送が聞こえたんだ。<hex:02100103>俺たちが知っているスフェーン王ではなかったとしても、<hex:02100103>間違いなく、俺たちを想ってくれる「王」の言葉だったよ。","0","0"
"600908","0","1","1","0","0","765","0","0","1","1","1","0","0","0","0","0","0","False","False","False","なあ、聞いたか？<hex:02100103>噂によると、黒いレギュレーターは5000個以上あるらしい。<hex:02100103>まったく、いったい何を信じたらいいんだ……。","0","0"
"600911","0","1","0","0","0","0","0","0","1","1","1","0","0","0","11","0","0","False","False","False","ガ……ガガ……。<hex:02100103>ただいま緊急メンテナンスを実行中です……。","0","0"
"600910","0","1","2","0","0","4218","5734","0","1","1","1","605","605","0","0","0","0","False","False","False","いつもご利用ありがとうございます。<hex:02100103>最近はスフェーン様もよく足を運んでくださるんですよ。","私が淹れたコーヒーを本当に美味しそうに召し上がるので、<hex:02100103>ついつい口元が緩んでしまいます。","0"
"600897","0","1","2","0","0","4218","0","0","1","1","1","0","0","0","0","0","0","False","False","False","いろいろなことが起きて気が滅入りますね……。<hex:02100103>でも、モノム社長が平常運転でいてくれるから、<hex:02100103>私は平静を保てているんだと思います。","0","0"
"600896","0","1","2","0","0","4218","0","0","1","1","1","6215","0","0","0","0","0","False","False","False","今までは嫌なことを忘れるためにアルコールに頼ってたけど、<hex:02100103>これからは、今を楽しむために飲もうかなって。<hex:02100103>……あのとき、スフェーン様の声に救われたからよ。","0","0"
"600899","0","1","2","0","0","4219","0","0","1","1","1","0","0","0","0","0","0","False","False","False","いらっしゃい、雑貨も食用品も取り揃えてるよ。<hex:02100103>近頃はトライヨラからの輸入食品なんかも仕入れていて、<hex:02100103>美味しくて美容や健康にもいいと評判だよ。","0","0"
"600898","0","1","2","0","0","5696","0","0","1","1","1","605","0","0","0","0","0","False","False","False","モノム社長ったら、いつにも増して気合入っちゃって、<hex:02100103>すごい勢いで仕事に打ち込んでるんですよ。<hex:02100103>どうやら、あなた方の活躍を聞いて燃えてるみたいです。","0","0"
"600901","0","1","2","0","0","757","0","0","1","1","1","0","0","0","0","0","0","False","False","False","恐れながら、黒いレギュレーターはお譲りできません。<hex:02100103>これは私のものですから……渡しませんよ……。","0","0"
"600900","0","1","2","0","0","4218","0","0","1","1","1","0","0","0","11","0","0","False","False","False","登録番号照会……スフェーン陛下の友人と確認……<hex:02100103>こちらは第九層公務施設、レゾリューションです。<hex:02100103>ご不明な点がございましたら、奥の総合窓口へどうぞ。","0","0"
"600903","0","1","1","0","0","9072","0","0","1","1","1","625","0","0","0","0","0","False","False","False","妻の様子がおかしいんだ……。<hex:02100103>そこのモニターの映像を視聴してからというもの、<hex:02100103>一心不乱に祈りを捧げ続けていて……心配だよ。","0","0"
"600902","0","1","2","0","0","5734","4218","0","1","1","1","0","0","0","0","0","0","False","False","False","あの……ご迷惑をおかけして申し訳ありませんでした。<hex:02100103>こうして治療を終えて復帰できたのも、<hex:02100103>あなた様方のおかげだと伺っております。","この窓口も以前とは用途が変わりました。<hex:02100103>これまでは魂資源の交換窓口だったのですが、<hex:02100103>今では記憶返還の申請や相談も承っているのですよ。","0"
"600921","0","1","2","0","0","764","0","0","1","1","1","0","0","0","0","0","0","False","False","False","いらっしゃい、腹は減ってないか？<hex:02100103>こんなときだからこそ、食欲くらいは満たしていってくれよな。","0","0"
"600920","0","1","2","0","0","5696","0","0","1","1","1","0","0","0","0","0","0","False","False","False","トライヨラとの取引も開始したけど、<hex:02100103>エレクトロープ製品の輸出はガバメントの管理下にあるのよ。<hex:02100103>まあ、雷の力が必要だから、障壁の外では容易に使えないけどね。","0","0"
"600923","0","1","2","0","0","763","0","0","1","1","1","0","0","0","0","0","0","False","False","False","ときどき、あのドームの中の人が訪ねてくるのよ。<hex:02100103>生活や文化が、私たちとあまりにもかけ離れているから、<hex:02100103>話すことが何もかもが新鮮に聞こえるわ。","0","0"
"600922","0","1","2","0","0","764","0","0","1","1","1","605","0","0","0","0","0","False","False","False","いらっしゃい！<hex:02100103>ここであんたとウクラマト様がウチの商品を食べてくれたこと、<hex:02100103>昨日のことのように思い出せるぜ。","0","0"
"600925","0","1","1","0","0","755","0","0","1","1","1","0","0","0","0","0","0","False","False","False","なんだか、町のみんなの様子がおかしくて、<hex:02100103>雰囲気に呑まれたら俺までおかしくなっちまいそうだ……。<hex:02100103>はあ……よかったら、一杯付き合っていかないかい？","0","0"
"600924","0","1","2","0","0","708","0","0","1","1","1","0","0","0","0","0","0","False","False","False","この間、フーサタイ宿場町へ遊びに行ったの！<hex:02100103>踊り小屋や酒場でたっぷり楽しんだわ。<hex:02100103>やっぱり娯楽は人生に必要よね。","0","0"
"600927","0","1","1","0","0","755","0","0","1","1","1","0","0","0","0","0","0","False","False","False","いつもみたいに釣りに行こうとしたら、<hex:02100103>キープから戻ってきた人とばったり会ってね。<hex:02100103>どうやらレゾリューションで妙な映像が流れているらしい……。","0","0"
"600926","0","1","1","0","0","755","0","0","1","1","1","0","0","0","0","0","0","False","False","False","……さて、ここから再出発だ。<hex:02100103>一杯飲んだら、精一杯働くさ。<hex:02100103>君も飲んでいくかい？","0","0"
"600913","0","1","2","0","0","4218","0","0","1","1","1","0","0","0","11","0","0","False","False","False","当機は、9-14居住殻・02棟のコンシェルジュです。<hex:02100103>居住者に御用でしたら、レギュレーター、<hex:02100103>もしくはレゾリューションでの来客申請をお願いいたします。","0","0"
"600912","0","1","2","0","0","4218","0","0","1","1","1","0","0","0","11","0","0","False","False","False","当機は、9-14居住殻・01棟のコンシェルジュです。<hex:02100103>申し訳ありません、お客様の登録番号は、<hex:02100103>来客予定にございません。","0","0"
"600915","0","1","1","0","0","765","0","0","1","1","1","605","0","0","0","0","0","False","False","False","いろいろあったけれど、ここもすっかり日常が戻ったよ。<hex:02100103>穏やかな気持ちで草木を眺められる時間は、<hex:02100103>こんなに貴重で幸せなことなんだね。","0","0"
"600914","0","1","2","0","0","764","0","0","1","1","1","0","0","0","0","0","0","False","False","False","お友達に記憶返還のことを相談していたの。<hex:02100103>どんな記憶が戻ってくるのかわからないから怖くて、<hex:02100103>まだ申請するかどうか迷ってるのよ……。","0","0"
"600917","0","1","2","0","0","763","0","0","1","1","1","0","0","0","0","0","0","False","False","False","私の同胞の中にも、黒いレギュレーターを着けていた人がいてね。<hex:02100103>どうなるかと思ったけど、エレダイト族の女の子が治療してくれて、<hex:02100103>今やすっかり元気よ……本当にありがたいことだわ。","0","0"
"600916","0","1","2","0","0","5734","0","0","1","1","1","605","0","0","0","0","0","False","False","False","アンタがこの国を救ってくれたっていう……。<hex:02100103>スフェーン様が教えてくれたんだ、本当に感謝してるよ。","0","0"
"600919","0","1","0","0","0","766","0","0","1","1","1","0","0","0","0","0","0","False","False","False","ふぅむ……。<hex:02100103>こうして異星に降り立ち、しばらくを過ごしてみても、<hex:02100103>なかなか求めるインスピレーションというものは……。","0","0"
"600918","0","1","2","0","0","764","0","0","1","1","1","0","0","0","0","0","0","False","False","False","退屈に思える日常のなかにも、<hex:02100103>小さな楽しみや幸せが転がっているものなのね。<hex:02100103>スフェーン様とお話ししていて、やっとそれに気づけたの。","0","0"
"600937","0","1","2","0","0","4219","0","0","1","1","1","0","0","0","0","0","0","False","False","False","こうして仕事に没頭していれば、多少は落ち着きます。<hex:02100103>と言っても、気持ちが晴れることはありませんがな。","0","0"
"600936","0","1","2","0","0","5695","4218","0","1","1","1","0","605","0","0","0","0","False","False","False","やあ、君もひと休みかい？<hex:02100103>……いま、自分たちに何ができるかって話してたところだよ。","大したことはできないけどさ。<hex:02100103>命を落とした仲間たちに、恥じない生き方をしたい……<hex:02100103>とにかく、そう強く感じているんだ。","0"
"600939","0","1","2","0","0","766","0","0","1","1","1","0","0","0","0","0","0","False","False","False","キープ暮らしのお友だちから教えてもらったのだけど、<hex:02100103>レゾリューションのモニターに特別な映像が流れているらしいの。<hex:02100103>私も見に行ってみようかしら……。","0","0"
"600938","0","1","2","0","0","4218","0","0","1","1","1","0","0","0","0","0","0","False","False","False","拾った資材を換金したら、医療施設に寄付します。<hex:02100103>今もこの先も、医療はもっと必要になると思いますでな。","0","0"
"600941","0","1","2","0","0","764","0","0","1","1","1","0","0","0","0","0","0","False","False","False","……みんな不安になっていますね。<hex:02100103>ここで採れた野菜を食べて、元気になってほしいものです。","0","0"
"600940","0","1","2","0","0","5696","0","0","1","1","1","0","0","0","0","0","0","False","False","False","キープのお友だちに農地のお野菜料理を持っていったら、<hex:02100103>美味しい、美味しいって涙を流していたのよ……。<hex:02100103>あのときよっぽど怖い思いをしたのね。","0","0"
"600943","0","1","2","0","0","763","0","0","1","1","1","0","0","0","0","0","0","False","False","False","この間、スフェーン様が視察に来てくださったんだ。<hex:02100103>帰り際に、旧市街の方を寂しげに見つめていらして……<hex:02100103>あの方にとっては、馴染み深い街なわけですからね。","0","0"
"600942","0","1","2","0","0","763","0","0","1","1","1","0","0","0","0","0","0","False","False","False","今日も街へと、たくさん出荷していますよ。<hex:02100103>この農地で育った野菜が、みんなを元気にするんです。","0","0"
"600929","0","1","2","0","0","4219","0","0","1","1","1","0","0","0","0","0","0","False","False","False","……私は黒いレギュレーターを持っていないから、<hex:02100103>死ぬのは怖いけど、いつもどおり仕事をするしかないのよね。","0","0"
"600928","0","1","1","0","0","755","0","0","1","1","1","0","0","0","0","0","0","False","False","False","あのとき、アウトスカーツにも放送の声が聞こえたんだ。<hex:02100103>僕の釣りの話をいつも聞いてくれていたあの方じゃなくても、<hex:02100103>優しくて、温かい言葉に胸が熱くなったよ。","0","0"
"600931","0","1","2","0","0","766","0","0","1","1","1","0","0","0","0","0","0","False","False","False","ソリューション・ナインを清掃しに行ったのだけど、<hex:02100103>街の人たちはみんな、黒いレギュレーターの話をしていたわ。<hex:02100103>どこかに落ちて……ないわよね。","0","0"
"600930","0","1","2","0","0","4218","0","0","1","1","1","0","0","0","0","0","0","False","False","False","植物も私たちも、命の終わりが必ずくるのだから、<hex:02100103>少しでもその実りが豊かになるように……<hex:02100103>大切に育んでいかないとね。","0","0"
"600933","0","1","2","0","0","1041","0","0","1","1","1","0","0","0","0","0","0","False","False","False","機械兵の騒動が落ち着いたと思ったら、<hex:02100103>今度は妙な映像を見たなどと言って、町の連中がざわついている。<hex:02100103>あいにく、私はその類の話には興味がないのでね。","0","0"
"600932","0","1","2","0","0","5734","0","0","1","1","1","0","0","0","0","0","0","False","False","False","あなたたちが戦ってくれたんだってね。<hex:02100103>清掃人の私には何も返せるものがないけど、<hex:02100103>感謝だけは伝えさせて……本当に、ありがとう。","0","0"
"600935","0","1","2","0","0","5695","4218","0","1","1","1","0","0","0","0","0","0","False","False","False","やあ、君もひと休みかい？<hex:02100103>いま、黒いレギュレーターについて話してたところだよ……。","あたしたちは寿命がほかの種族よりも長いから、<hex:02100103>優先的にほかの種族に配布するべきだったって言われてさ……。<hex:02100103>死が怖いのはみんな同じなのにね。","0"
"600934","0","1","2","0","0","763","0","0","1","1","1","0","0","0","0","0","0","False","False","False","もとより永遠の命というものに関心はなかったが、<hex:02100103>軍事研究に携わる者として、次なる目標を見出すことができた。<hex:02100103>目指すは限りある命を守る、安全第一の機械兵だ。","0","0"
"600953","0","0","0","0","0","0","0","0","0","0","0","0","0","0","0","0","0","False","False","False","","",""
"600952","0","0","0","0","0","0","0","0","0","0","0","0","0","0","0","0","0","False","False","False","","",""
"600955","0","0","0","0","0","0","0","0","0","0","0","0","0","0","0","0","0","False","False","False","","",""
"600954","0","0","0","0","0","0","0","0","0","0","0","0","0","0","0","0","0","False","False","False","","",""
"600957","0","1","2","0","0","4218","0","0","1","1","1","0","0","0","11","0","0","False","False","False","長らくお待たせいたしました！<hex:02100103>イェスタランド名物の回転木馬、<hex:02100103>「ラウンダバウト・ベルクメア」をぜひお楽しみくださいーっ！","0","0"
"600956","0","0","0","0","0","0","0","0","0","0","0","0","0","0","0","0","0","False","False","False","","",""
"600959","0","1","2","0","0","4218","0","0","1","1","1","0","0","0","11","0","0","False","False","False","ようこそ、カナルタウンへ！<hex:02100103>船頭がいないためゴンドラは無期限休止しておりますが、<hex:02100103>美しい街並みをぜひご散策ください！","0","0"
"600958","0","1","2","0","0","4218","0","0","1","1","1","0","0","0","11","0","0","False","False","False","こんにちは、何かお困りでしょうか？<hex:02100103>生憎、永久人のお客様のお呼び出しはできかねますが、<hex:02100103>そのほかのことは何なりとお申し付けください。","0","0"
"600945","0","1","2","0","0","1041","0","0","1","1","1","0","0","0","0","0","0","False","False","False","いろいろなことが起きて、変わったこともあったが……<hex:02100103>物事の本質ってのはそう簡単には変わらないもんだ。","そういうものを見つけて、拾い集めて、大事に磨きあげていく。<hex:02100103>オレたち拾得人の得意とすることだが……アンタもだろ？","0"
"600944","0","1","2","0","0","5695","0","0","1","1","1","0","0","0","0","0","0","False","False","False","駆除人たちが、武器や防具の性能を強化しているそうだよ。<hex:02100103>それと、駆除に出るときは必ず何人かで組むようにするとか……<hex:02100103>魂資源が少ないから、慎重になるに越したことはないよな。","0","0"
"600947","0","1","2","0","0","5696","0","0","1","1","1","0","0","0","0","0","0","False","False","False","先日、障壁の外に出てみたのよ。<hex:02100103>本物の太陽の下で、乾いた大地を歩く日が来るなんて……<hex:02100103>少し前までは夢にも思わなかったわ。","0","0"
"600946","0","1","2","0","0","5734","0","0","1","1","1","0","0","0","0","0","0","False","False","False","知り合いの好事家が、記憶返還をしたらしいの。<hex:02100103>当然、愛する人を亡くしたことを思い出して、<hex:02100103>悲しみに苛まれたそうだけど……。","その人との思い出という、<hex:02100103>ほかにはない宝物を得たって、涙ながらに語っていたわ。","0"
"600949","0","1","2","0","0","767","0","0","1","1","1","0","0","0","0","0","0","False","False","False","よう、ロネークの様子を見に来たのか？<hex:02100103>心配しなくても大丈夫だ、万が一俺に何かあっても、<hex:02100103>数カ月は機械がこいつらの命を繋いでくれるさ。","0","0"
"600948","0","1","1","0","0","0","0","0","1","1","1","0","0","0","0","0","0","False","False","False","……ようやくこの国の悪夢も終わって、<hex:02100103>とっておきの遊戯、トリプルトライアドに熱中できるぜ。<hex:02100103>心に不安があっちゃ、楽しめるモンも楽しめないからな。","0","0"
"600951","0","0","0","0","0","0","0","0","0","0","0","0","0","0","0","0","0","False","False","False","","",""
"600950","0","1","2","0","0","5696","0","0","1","1","1","0","0","0","0","0","0","False","False","False","こいつらはこの国に起きたことなんて何にも知らねぇ。<hex:02100103>そのくせ繊細で、人の心の変化にはよく気付く……<hex:02100103>だからいつでも愛情を込めて世話してるのさ。","0","0"
"600969","0","0","0","0","0","0","0","0","0","0","0","0","0","0","0","0","0","False","False","False","","",""
"600968","0","0","0","0","0","0","0","0","0","0","0","0","0","0","0","0","0","False","False","False","","",""
"600971","0","1","2","0","0","711","0","0","1","1","1","605","0","0","0","0","0","False","False","False","仕事をがんばりゃ、酒がうまくなる。<hex:02100103>へへ、楽しくなってきやがったぜ……！","0","0"
"600970","0","0","0","0","0","0","0","0","0","0","0","0","0","0","0","0","0","False","False","False","","",""
"600973","0","0","0","0","0","0","0","0","0","0","0","0","0","0","0","0","0","False","False","False","","",""
"600972","0","1","2","0","0","758","764","0","1","1","1","0","6215","0","0","0","0","False","False","False","アーカイブの包丁への思い入れ、なんか気にならねぇか？<hex:02100103>ただの思い過ごしならいいんだが……。","さておき、石板には、まだほかにも匠の技術が記されてる。<hex:02100103>さらなる強化方法のヒントが得られるといいな。","0"
"600975","0","0","0","0","0","0","0","0","0","0","0","0","0","0","0","0","0","False","False","False","","",""
"600974","0","0","0","0","0","0","0","0","0","0","0","0","0","0","0","0","0","False","False","False","","",""
"600961","0","1","2","0","0","4219","0","0","1","1","1","0","0","0","0","0","0","False","False","False","あらあら、ようこそ！<hex:02100103>あなたならいつでも大歓迎なんだから、<hex:02100103>気が済むまでゆっくり休んでいってね。","0","0"
"600960","0","1","1","0","0","765","0","0","1","1","1","605","0","0","0","0","0","False","False","False","ウクラマト様もコーナ様も、すっかり頼もしくなられてさ。<hex:02100103>トライヨラにもかつての活気が戻って本当に嬉しいよ。","0","0"
"600963","0","0","0","0","0","0","0","0","0","0","0","0","0","0","0","0","0","False","False","False","","",""
"600962","0","1","1","0","0","765","0","0","1","1","1","0","0","0","0","0","0","False","False","False","トラル勇連隊隊長の座はしばらく空席だったが、<hex:02100103>先日、私が正式に就任したよ。","……とはいえ、やることは変わらない。<hex:02100103>民の平穏な暮らしを護るために勇連隊士をまとめあげ、<hex:02100103>私自身も前隊長に劣らぬよう……日々訓練に励むつもりさ。","0"
"600965","0","0","0","0","0","0","0","0","0","0","0","0","0","0","0","0","0","False","False","False","","",""
"600964","0","0","0","0","0","0","0","0","0","0","0","0","0","0","0","0","0","False","False","False","","",""
"600967","0","0","0","0","0","0","0","0","0","0","0","0","0","0","0","0","0","False","False","False","","",""
"600966","0","0","0","0","0","0","0","0","0","0","0","0","0","0","0","0","0","False","False","False","","",""
"600985","0","1","2","0","0","764","0","0","1","1","1","0","0","0","0","0","0","False","False","False","廃棄されたプリザベーションの研究施設……。<hex:02100103>少し怖くもあるけど、怯んでなんかいられないよ。","0","0"
"600984","0","0","0","0","0","0","0","0","0","0","0","0","0","0","0","0","0","False","False","False","","",""
"600987","0","1","2","0","0","4218","0","0","1","1","1","0","0","0","0","0","0","False","False","False","どうやって格納殻10-29の存在に行き着いたかは、また追々……。<hex:02100103>坑道でお話しした、バックルーム発見に至る秘話と、<hex:02100103>おおよそ同じことですよ。","0","0"
