"599607","0","1","0","0","0","0","0","5533","1","1","1","0","0","0","0","0","0","False","False","False","……こんなところまで、よく来てくれるね。<hex:02100103>物を大事に扱ってくれるなら、好きに過ごしてくれていいよ。","私たちは「拾得人」と呼ばれる者さ。<hex:02100103>エバーキープから流れ着いた瓦礫を拾い集めては、<hex:02100103>再利用できるように調整している。","ここは雷の力が強く過酷な環境だが、<hex:02100103>それでも私たちは、大地とともに生きたい。<hex:02100103>たとえ体内のエーテルバランスが崩壊し、盲目になってもね。"
"599606","0","1","2","0","0","724","0","0","1","1","1","0","0","0","0","0","0","False","False","False","仕事、仕事、山積みの仕事！<hex:02100103>限界突破してやンぜぇぇぇぇぇぇ！","0","0"
"599625","0","1","2","0","0","4219","0","0","1","1","1","0","0","0","11","0","0","False","False","False","やあ、よく来たね！<hex:02100103>ヴォルケーノアサイラムへ出発するかい？","0","0"
"599624","0","1","2","0","0","4219","0","0","1","1","1","0","0","0","11","0","0","False","False","False","やあ、よく来たね！<hex:02100103>イェスタランドには、このジップラインで向かえるよ！","0","0"
"599627","0","1","2","0","0","4219","0","0","1","1","1","0","0","0","11","0","0","False","False","False","こんにちは！<hex:02100103>リメンバー・ゲートへ戻るなら、このジップラインを使ってね！","0","0"
"599626","0","1","2","0","0","4219","0","0","1","1","1","0","0","0","11","0","0","False","False","False","ようこそ、ようこそ！<hex:02100103>ウィンドパスガーデンへ出発するかい？","0","0"
"599629","0","1","2","0","0","4219","0","0","1","1","1","0","0","0","11","0","0","False","False","False","こんにちは！<hex:02100103>リメンバー・ゲートへ戻るなら、このジップラインを使ってね！","0","0"
"599628","0","1","2","0","0","4219","0","0","1","1","1","0","0","0","11","0","0","False","False","False","こんにちは！<hex:02100103>リメンバー・ゲートへ戻るなら、このジップラインを使ってね！","0","0"
"599631","0","1","2","0","0","763","0","0","1","1","1","0","0","0","0","0","0","False","False","False","少し休ませているのですよ、長旅をさせてしまいましたから。<hex:02100103>先日の大嵐で、道もずいぶん荒れてしまっていて……<hex:02100103>いつもより疲労しているでしょうからね。","0","0"
"599630","0","1","2","0","0","4219","0","0","1","1","1","0","0","0","11","0","0","False","False","False","こんにちは！<hex:02100103>リメンバー・ゲートへ戻るなら、このジップラインを使ってね！","0","0"
"599617","0","1","1","2","0","755","4218","0","1","1","1","0","0","0","11","11","0","False","False","False","通行者を視認、<hex:02100103>基幹システムに照会を申請します……。","理王スフェーン陛下の客人として登録を確認。<hex:02100103>どうぞ、お通りください。","0"
"599616","0","1","1","2","0","755","4218","0","1","1","1","0","0","0","11","11","0","False","False","False","通行者を視認、<hex:02100103>基幹システムに照会を申請します……。","理王スフェーン陛下の客人として登録を確認。<hex:02100103>どうぞ、お通りください。","0"
"599619","0","1","1","0","0","755","0","0","1","1","1","0","0","0","0","0","0","False","False","False","あんたのことは通すよう言われている。<hex:02100103>奥の部屋へ行くのか？","0","0"
"599618","0","1","1","2","0","755","4218","0","1","1","1","0","0","0","11","11","0","False","False","False","通行者を視認、<hex:02100103>基幹システムに照会を申請します……。","エバーキープ内の、無期限の滞在許可を確認。<hex:02100103>どうぞ、お通りください。","0"
"599621","0","1","2","0","0","763","0","0","1","1","1","0","0","0","0","0","0","False","False","False","<hex:022C0DFF07022903EB0203FF02200203>。<hex:02100103>わしの可愛い孫、セートジャは無事か？","村の命綱である祭器も心配じゃが、<hex:02100103>遠い外つ国であの子がどうしているかが、一番気がかりじゃ。","0"
"599620","0","1","2","0","0","5533","0","0","1","1","1","0","0","0","0","0","0","False","False","False","困ったのう……困ったのう……。<hex:02100103>わしの可愛い孫が……。","0","0"
"599623","0","1","2","0","0","4219","0","0","1","1","1","0","0","0","11","0","0","False","False","False","ようこそ、ようこそ！<hex:02100103>カナルタウンには、このジップラインで向かえるよ！","0","0"
"599622","0","2","2","0","0","764","0","0","1","1","1","0","0","0","0","0","0","False","False","False","さあ、ヤクテル樹海行きの気球はまもなく出発だ！<hex:02100103>乗り遅れないようにしてくれよな！","0","0"
"599641","0","1","2","0","0","764","0","0","1","1","1","0","0","0","0","0","0","False","False","False","新たな連王の誕生に国中が沸いているときに、あんなこと……。<hex:02100103>ウクラマト様のため、私たちにできることがあれば言ってね。","0","0"
"599640","0","1","2","0","0","5695","0","0","1","1","1","0","0","0","0","0","0","False","False","False","トライヨラから持ち帰ったタコスを、マムークの皆に配ったら、<hex:02100103>あまりの美味しさに、取り合いになるほどの騒ぎになってね。<hex:02100103>おかわりを求めて王都へ旅に出る人までいたんだから！","0","0"
"599643","0","1","2","0","0","764","0","0","1","1","1","0","0","0","0","0","0","False","False","False","誤った路を進んできた私にできることは、<hex:02100103>過ちを認め、二度と繰り返さぬようにすることだ……。","0","0"
"599642","0","1","2","0","0","4236","0","0","1","1","1","0","0","0","0","0","0","False","False","False","ともに生きよう、か。<hex:02100103>なぜ私は、もっと早くその手を掴まなかったのか……。","0","0"
"599645","0","1","2","0","0","763","0","0","1","1","1","0","0","0","0","0","0","False","False","False","そうか、お前がエオルゼアで有名な冒険者だな？<hex:02100103>トライヨラに立ち寄ったときに船乗りから聞いたんだ。","お前のような奴が一緒なら安心だ。<hex:02100103>ウクラマトをよろしく頼むぞ。","0"
"599644","0","1","2","0","0","5696","0","0","1","1","1","0","0","0","0","0","0","False","False","False","王都が襲撃を受けたとフンムルクより聞き及び、<hex:02100103>あまり多くはないが、戦える者を勇連隊に回しておいた。<hex:02100103>私も向かいたいが、この混乱の中で集落を離れるわけには……。","0","0"
"599647","0","1","2","0","0","764","0","0","1","1","1","0","0","0","0","0","0","False","False","False","継承の儀が終わったら隠居しようと思っていたが、<hex:02100103>しばらくの間は、当代の連王を陰ながら支えていくさ。<hex:02100103>頼まれちまったからな、あいつに……。","0","0"
"599646","0","1","2","0","0","4218","0","0","1","1","1","0","0","0","0","0","0","False","False","False","ウクラマトは、お前という仲間と出会うことで成長を果たした。<hex:02100103>あいつがこの先トライヨラをどう変えていくのか、楽しみだ。","0","0"
"599633","0","1","2","0","0","764","0","0","1","1","1","0","0","0","0","0","0","False","False","False","ゆっくり見ていってくれよな！<hex:02100103>ポップコーンにクッキー、マグカップや人形なんかもあるぜ！","0","0"
"599632","0","2","2","0","0","764","0","0","1","1","1","0","0","0","0","0","0","False","False","False","オルコ・パチャへ向かわれるのですか？<hex:02100103>それならぜひお乗りください、このアルパカに。<hex:02100103>快適な旅をお約束しますよ。","0","0"
"599635","0","1","2","0","0","764","0","0","1","1","1","0","0","0","0","0","0","False","False","False","たかがアルパカと舐めてかからない方がいいですよ。<hex:02100103>試練なのですから、王を決めるための、ええ。","0","0"
"599634","0","1","1","0","0","755","0","0","1","1","1","0","0","0","0","0","0","False","False","False","ヴォルケーノアサイラムの名物、<hex:02100103>ゴールデンスターアイスクリームはどうだい？","0","0"
"599637","0","1","2","0","0","764","0","0","1","1","1","0","0","0","0","0","0","False","False","False","立派なものだろう？<hex:02100103>じっくり見ていってくれ、私の茶園をね。","0","0"
"599636","0","1","2","0","0","763","0","0","1","1","1","0","0","0","0","0","0","False","False","False","王の選者たる者、特定の継承候補者に肩入れしたりはしません。<hex:02100103>ですが、マーブルは良い影響を受けたようですよ、<hex:02100103>ウクラマト王女から、ええ。","0","0"
"599639","0","1","2","0","0","764","0","0","1","1","1","0","0","0","0","0","0","False","False","False","あなたたちとウクラマト王女のおかげで、<hex:02100103>私たちにも夜明けが訪れた。<hex:02100103>今度こそ、この路を皆で進んでいくわ。","0","0"
"599638","0","1","1","0","0","0","0","0","0","1","1","0","0","0","0","0","0","False","False","False","……………………。","0","0"
"599657","0","1","0","0","0","0","0","0","0","1","1","0","0","0","0","0","0","False","False","False","…………。","0","0"
"599656","0","1","0","0","0","757","0","0","2","1","1","612","0","0","0","0","0","False","False","False","そんな……グルージャジャさん……。","0","0"
"599659","0","1","1","0","0","0","0","0","3","1","1","0","0","0","0","0","0","False","False","False","すでに事切れている……残念だよ……。","0","0"
"599658","0","0","0","0","0","0","0","0","0","0","0","0","0","0","0","0","0","False","False","False","","",""
"599661","0","1","0","0","0","0","0","0","3","1","1","0","0","0","0","0","0","False","False","False","まだ痛むのなら、<hex:02100103>無理に動かなくてもいい……。","0","0"
"599660","0","1","0","0","0","0","0","0","3","1","1","0","0","0","0","0","0","False","False","False","もう大丈夫ですよ。<hex:02100103>治癒魔法で傷は塞ぎましたから……。","0","0"
"599663","0","1","2","0","0","766","0","0","1","1","1","0","0","0","0","0","0","False","False","False","不意打ちされたにせよ、<hex:02100103>秘石を奪われたのは失態だった。<hex:02100103>まさか、こんなことに繋がるなんてな……。","それにしても、ゾラージャの奴……本気で殺しにきやがって。<hex:02100103>俺じゃなかったら死んでたぞ。","0"
"599662","0","1","2","0","0","5695","0","0","1","1","1","0","0","0","0","0","0","False","False","False","鏡像世界……僕たちだけじゃ何もわからずじまいでした。<hex:02100103>トライヨラ始まって以来の、この危機を乗り切るためにも、<hex:02100103>ぜひみなさんの力を貸してください……！","0","0"
"599649","0","1","2","0","0","764","0","0","1","1","1","0","0","0","0","0","0","False","False","False","申し訳ありませんが、<hex:02100103>通行許可証がない方はお通しできません。","0","0"
"599648","0","1","2","0","0","4219","0","0","1","1","1","0","0","0","0","0","0","False","False","False","ういうい！<hex:02100103>私は信じてるよ！<hex:02100103>王女様なら、継承の儀を勝ち抜けるってね！","0","0"
"599651","0","1","0","0","0","0","0","0","3","1","1","0","0","0","0","0","0","False","False","False","あいつ……無茶しないといいんだけどな……。","0","0"
"599650","0","1","1","0","0","0","0","0","3","1","1","0","0","0","0","0","0","False","False","False","…………ジロジロ見ないでよ。","0","0"
"599653","0","1","0","0","0","757","0","0","3","1","1","6227","0","0","0","0","0","False","False","False","なんということだ……。","0","0"
"599652","0","1","0","0","0","757","0","0","3","1","1","0","0","0","0","0","0","False","False","False","父さん……！<hex:02100103>嫌だ、諦めるもんか……！","0","0"
"599655","0","1","2","0","0","763","0","0","1","1","1","612","0","0","0","0","0","False","False","False","手は……尽くしたわ……。<hex:02100103>でも……っ……もういいって……言われて……。","0","0"
"599654","0","1","0","0","0","0","0","0","2","1","1","0","0","0","0","0","0","False","False","False","くっ……！","0","0"
"599673","0","1","0","0","0","0","0","0","1","1","1","0","0","0","0","0","0","False","False","False","最近、変わり種のタコスもあるらしいけど……<hex:02100103>やっぱり、シャバーブチェが一番だね。<hex:02100103>この肉を引き立てるスパイスが絶妙なんだよ。","0","0"
"599672","0","1","1","0","0","0","0","0","1","1","1","0","0","0","0","0","0","False","False","False","トライヨラは、いろんな部族が暮らしてるでしょう？<hex:02100103>そこでこのシャバーブチェ！<hex:02100103>ここに来れば、たいていの民族料理が食べられるんだ。","一番人気は、やっぱりタコスだろうね。<hex:02100103>「タコスと言えば」な王道の味付けになってて、<hex:02100103>あなたも一度食べたら、やみつき間違いなしだよ。","0"
"599675","0","1","2","0","0","738","0","0","1","1","1","0","0","0","0","0","0","False","False","False","うちはタコスはもちろん、お酒もおすすめだよ！<hex:02100103>フルーティーな甘さが、辛いタコスとの相性バッチリ！<hex:02100103>ぜひ楽しんでいってね。","0","0"
"599674","0","1","2","0","0","945","0","0","1","1","1","0","0","0","0","0","0","False","False","False","はいはいはい、「タコスのチーちゃん」、営業中でございます～！<hex:02100103>うちは、ヘルシーな鶏肉やお野菜たっぷりのタコスもあるわよぉ。<hex:02100103>ソースもい～っぱい用意してるから、ぜひぜひお試しあれ～！","ちなみに、ここが「チーちゃん」の総本店なのよぉ！<hex:02100103>2号店はまだないんだけどねぇ～、あっはは！","0"
"599677","0","1","1","0","0","0","0","0","1","1","1","0","0","0","0","0","0","False","False","False","ここはブライトプルーム・ポスト……トラル勇連隊の詰め所だ。<hex:02100103>隊長のゾラージャ様のもと、周辺の警備や訓練をしている。<hex:02100103>自由に出入りして構わんが、変な真似はするなよ。","0","0"
"599676","0","1","2","0","0","764","0","0","1","1","1","0","0","0","0","0","0","False","False","False","こんなデカいもんが、まさか空を飛ぶなんてなぁ……。<hex:02100103>少し前まで考えもしなかった。<hex:02100103>おかげで深い森の上もひとっ飛びさ。","0","0"
"599679","0","1","2","0","0","763","0","0","1","1","1","0","0","0","0","0","0","False","False","False","こうして訓練を重ねちゃいるが、トライヨラは平和なもんだよ。<hex:02100103>80年ほど前までは各地で戦が絶えなかったらしいけど、<hex:02100103>いまの時代からすると、ぜんぜん実感湧かないよな。","0","0"
"599678","0","1","1","0","0","0","0","0","1","1","1","0","0","0","0","0","0","False","False","False","この塔が気になるか？<hex:02100103>これはフヌイリーの塔という名の灯台さ。<hex:02100103>近海の船に、大橋と大瀑布が近いことを知らせているんだよ。","0","0"
"599665","0","1","2","0","0","5695","0","0","1","1","1","0","0","0","0","0","0","False","False","False","あー、なんか腹立ってきた！<hex:02100103>自警隊は何やってんのよもう！","0","0"
"599664","0","1","2","0","0","4219","0","0","1","1","1","0","0","0","0","0","0","False","False","False","ひと足先に戻らせてもらったよ。<hex:02100103>それにしても、なかなかのスリルだったじゃないか！","0","0"
"599667","0","1","1","0","0","0","0","0","3","1","1","0","0","0","0","0","0","False","False","False","海都の新生祭、多くの人に来てもらえて何よりだよ。<hex:02100103>君もぜひ、この空気を味わっていってほしい。","0","0"
"599666","0","1","2","0","0","763","0","0","1","1","1","0","0","0","0","0","0","False","False","False","この先は、コザマル・カに通じています。<hex:02100103>ただ、先日の大嵐の影響で道もひどい状態で……<hex:02100103>安全の確認が取れるまで、通行を制限しております。","0","0"
"599669","0","1","2","0","0","764","0","0","1","1","1","0","0","0","0","0","0","False","False","False","じゃあ次は、こっちの箱をお願い……って、あら？<hex:02100103>ごめんなさい、荷運びの人が来たのかと思っちゃったわ。","0","0"
"599668","0","1","2","0","0","766","0","0","1","1","1","0","0","0","0","0","0","False","False","False","あれれ～、おかしいなぁ？<hex:02100103>海の向こうから届いた荷物を確認してるんだけど、<hex:02100103>数が合わないんだよねぇ……。","0","0"
"599671","0","1","2","0","0","5696","0","0","1","1","1","0","0","0","0","0","0","False","False","False","コーナ様がシャーレアンに留学されてから、<hex:02100103>少しずつ外つ国から届く荷物も増えてきてね。<hex:02100103>見たことのない物も届くから、取り扱いには要注意なのさ。","0","0"
"599670","0","1","2","0","0","950","0","0","1","1","1","0","0","0","0","0","0","False","False","False","おっと、ここの荷物は動かさないでくれよ！<hex:02100103>まだ仕分けが終わってないんだ。","0","0"
"599689","0","1","1","0","0","0","0","0","1","1","1","0","0","0","0","0","0","False","False","False","……大抵のカクテルは作れるし、<hex:02100103>ノンアルコールも可能だ。<hex:02100103>喉が乾いたならオーダーを。","0","0"
"599688","0","1","2","0","0","9058","0","0","1","1","1","624","0","0","0","0","0","False","False","False","乗機のカスタムなら、俺に任せな。<hex:02100103>最高にイケてるセッティングで、<hex:02100103>テメエをてっぺんまで連れていってやるぜ！","0","0"
"599691","0","1","2","0","0","707","0","0","1","1","1","0","0","0","0","0","0","False","False","False","モノム社長の腕は間違いないし、ファンも多いんだけど、<hex:02100103>職人によくいる、費用対効果を考えない人なんです。<hex:02100103>風を受けて七色に光るエアロパーツなんて、誰が使うの……？","0","0"
"599690","0","1","2","0","0","933","0","0","1","1","1","0","0","0","0","0","0","False","False","False","売るときにちゃんと年齢確認しろってお上がうるさいから、<hex:02100103>アルコールを買うときは、登録番号を照会させて。<hex:02100103>ソフトドリンクは、隣の自販機から自由に買ってちょうだい。","0","0"
"599693","0","1","2","0","0","4218","0","0","1","1","1","0","0","0","11","0","0","False","False","False","登録番号照会……スフェーン陛下の客人と確認……<hex:02100103>こちらは第九層公務施設、レゾリューションです。<hex:02100103>ご不明な点がございましたら、奥の総合窓口へどうぞ。","0","0"
"599692","0","1","2","0","0","5696","0","0","1","1","1","0","0","0","0","0","0","False","False","False","ここは道に迷い、道を求める方が訪れる導きの場。<hex:02100103>しかしながら、我が主の占いは誰しもが求めるもの……<hex:02100103>予約は先々まで埋まっているので、ご了承くださいませ。","0","0"
"599695","0","1","2","0","0","4218","0","0","1","1","1","0","0","0","0","0","0","False","False","False","こちらは魂資源の交換窓口になります。<hex:02100103>まずは身体情報とレギュレーターの状態を確認……って、<hex:02100103>あら、どうやら市民として登録されていませんよ。","0","0"
"599694","0","1","2","0","0","4218","0","0","1","1","1","0","0","0","0","0","0","False","False","False","ガバメントセクターへようこそ。<hex:02100103>こちらは職業関連のインフォメーションになります。<hex:02100103>ご不明な点がございましたら、気軽にお尋ねください。","0","0"
"599681","0","1","2","0","0","5695","0","0","1","1","1","605","0","0","0","0","0","False","False","False","トライヨラに越してきてから、<hex:02100103>こうして野菜が育ってくれるのが、楽しくて仕方ないんだ！<hex:02100103>故郷の土地は、ちょっと訳ありだったからね。","0","0"
"599680","0","1","2","0","0","763","0","0","1","1","1","0","0","0","0","0","0","False","False","False","それぞれ体捌きが違ったりしていて興味深いね。<hex:02100103>トラル勇連隊にはいろんな部族がいるからね、<hex:02100103>部族によって体の使い方が違ったりして面白いんだ。","0","0"
"599683","0","1","1","0","0","0","0","0","1","1","1","624","0","0","0","0","0","False","False","False","ここから先は、ヴォロク連王宮です。<hex:02100103>連王様は寛大なお方ですが、御無礼のないように。","0","0"
"599682","0","1","2","0","0","764","0","0","1","1","1","0","0","0","0","0","0","False","False","False","アンタは、継承の儀で誰が選ばれると思う？<hex:02100103>もう街中その話題で持ち切りなんだよ！","0","0"
"599685","0","1","0","0","0","766","0","0","1","1","1","0","0","0","0","0","0","False","False","False","ううむ、どこかに力ある狩人はいないだろうか……。","0","0"
"599684","0","1","2","0","0","764","0","0","1","1","1","0","0","0","0","0","0","False","False","False","この先は「金凰の間」です。<hex:02100103>現在、グルージャジャ様が政務にあたられているため、<hex:02100103>申し訳ございませんが、中へお通しすることはできません。","0","0"
"599687","0","1","2","0","0","4218","0","0","1","1","1","605","0","0","0","0","0","False","False","False","どんなときでも、お客様の力となる飲み物を提供いたします。<hex:02100103>精がつくもの、目が覚めるもの、ちょっとした薬になるもの、<hex:02100103>各種取り揃えていますので、どうぞお申しつけください。","0","0"
"599686","0","1","2","0","0","5695","0","0","1","1","1","605","0","0","0","0","0","False","False","False","ようこそ、ソリューション・ナインへ。<hex:02100103>当店の人気商品「天使のおやつ」はいかがですか？","0","0"
"599705","0","1","2","0","0","763","0","0","1","1","1","0","0","0","0","0","0","False","False","False","アンタ、見ない顔だね。<hex:02100103>新しい入居者……というわけでもなさそうだ。<hex:02100103>部外者がうろちょろするのは、あまり感心しないよ。","0","0"
"599704","0","1","1","0","0","9072","0","0","1","1","1","0","0","0","0","0","0","False","False","False","どの居住殻も、入口前はこうやって緑が植えてあって、<hex:02100103>みんなの憩いの場所になっているんだ。<hex:02100103>どれだけ技術が進んでも、人には草木が必要なのさ。","0","0"
"599707","0","1","2","0","0","764","0","0","1","1","1","0","0","0","0","0","0","False","False","False","いらっしゃい、この店じゃ雑貨や食用品を扱ってるよ。<hex:02100103>オススメは、栄養素とフレーバーを付加した飲用水……<hex:02100103>あとは、食べるとお腹が光るドロップもイチオシだね。","0","0"
"599706","0","1","2","0","0","9004","0","0","1","1","1","0","0","0","0","0","0","False","False","False","シャトナ族の集落と違って、居住殻は人の繋がりが薄いのよ。<hex:02100103>それがいいって人もいるけど、いざってときに困るから、<hex:02100103>普段から関係を持って、情報交換をしておかないとね。","0","0"
"599709","0","1","1","0","0","9072","0","0","1","1","1","0","0","0","0","0","0","False","False","False","君も感じるかい、この豊かな香りを？<hex:02100103>これは「キーベル・カピー農園」で栽培された、<hex:02100103>とっても美味しいコーヒービーンで淹れたものだよ。","0","0"
"599708","0","1","2","0","0","764","0","0","1","1","1","0","0","0","0","0","0","False","False","False","君のように旅慣れていそうな人を見ると、<hex:02100103>あちらこちらを探検してまわっていた頃を思い出すよ。<hex:02100103>まったく、懐かしいものだね……。","0","0"
"599711","0","1","2","0","0","5696","0","0","1","1","1","0","0","0","0","0","0","False","False","False","いらっしゃい、オルコ・パチャは冷えるだろう？<hex:02100103>提供できるよ、温まる飲み物と楽しいひとときをね。","0","0"
"599710","0","1","2","0","0","764","0","0","1","1","1","0","0","0","0","0","0","False","False","False","「ミープル・マテ茶園」にはもう行ったかしら？<hex:02100103>少し離れた場所にあるけれど、<hex:02100103>あの大きな茶園、一度は見てもらいたいわ。","0","0"
