"599459","0","1","2","0","0","762","763","0","1","1","1","0","0","0","0","0","0","False","False","False","ビャファッ！？<hex:02100103>ご、ご機嫌うるわしゅう<hex:022C0DFF07022903EB0203FF02200203>さん！<hex:02100103>今日もモンスターひしめく危険地帯にお出かけで……！？","ウチらの仕事は超絶はかどってるんで、<hex:02100103>じき、さらに高性能な武具が出回るはずです。<hex:02100103>もはや怖いものはねーですよ！","なんで……その……新しい危険地帯に踏み入れた際は、<hex:02100103>未知のモンスターの情報とか、あわよくば模型とか、<hex:02100103>よろしくお願いしますッ！"
"599458","0","1","2","0","0","763","0","4219","1","1","1","0","0","0","0","0","0","False","False","False","ああ、どうもこんにちは！<hex:02100103>おかげさまで猫さんたちは今日もご機嫌でいい香り……<hex:02100103>マルセット氏と進めている研究も順調だよ。","彼女が唱える「古代レビテト因子要因説」というのはね、<hex:02100103>古の時代、何者かが浮遊魔法を多様な生物にかけた結果、<hex:02100103>現代の生物には潜在的にその因子が残っているとする説なんだ。","何らかの要因でレビテト因子が活性化した個体は、<hex:02100103>まるで浮遊魔法がかけられたかのような状態となる。<hex:02100103>重力から解き放たれ、空を舞うことができるわけさ。"
"599461","0","1","2","0","0","764","0","0","1","1","1","0","0","0","0","0","0","False","False","False","ねえ、よければトリプルトライアドで遊ばない？<hex:02100103>ご託宣をいただく順番待ちをしているんだけど、<hex:02100103>いつまでも私の番がこなくて、暇を持て余しているの。","0","0"
"599460","0","1","1","0","0","9002","0","9072","1","1","1","0","0","0","0","0","0","False","False","False","ああ、あなたですか……。<hex:02100103>ご覧のとおり、今日はきちんと休憩を取っていますよ。","くだんの「自動あたため機構」の試作品を、<hex:02100103>研究員向けの休憩室に設置してみました。<hex:02100103>すると皆、注意書きも読まずにアレやコレやと突っ込んで……","何は溶ける、何は爆発すると書いたでしょうに……！<hex:02100103>疲れて頭の回らない状態でも使えるように、<hex:02100103>不適切な操作をしたら警告音を鳴らすべきですね。"
"599463","0","1","2","0","0","4219","0","0","1","1","1","0","0","0","0","0","0","False","False","False","あなた強いのね！<hex:02100103>ノフィカ様の御前で負けちゃったからには、<hex:02100103>どんなご託宣でも気を引き締めて受け取らないと……！","0","0"
"599462","0","1","2","0","0","933","0","0","1","1","1","0","0","0","0","0","0","False","False","False","この勝利はきっと、ノフィカ様のご加護のおかげね！<hex:02100103>きっと精霊様のご託宣も良い結果になるはず！","0","0"
"599481","0","1","2","0","0","763","755","0","1","1","1","0","0","0","0","0","0","False","False","False","やれやれ、ゲゲルジュの旦那に毒を盛るとは、<hex:02100103>エルレットって奴は厄介だな。","お前への協力を惜しむつもりはねぇから、<hex:02100103>どうにかして、連中を蹴散らすとしよう。","0"
"599480","0","1","1","1","0","755","755","0","1","1","1","0","0","0","0","0","0","False","False","False","はぁ……。<hex:02100103>カワイコちゃんからの差し入れに、<hex:02100103>幻覚を見せる毒だか薬だかが盛られておったとはのぅ～。","しかし、カワイコちゃんからの贈り物なら、<hex:02100103>ワシは何でも、どんとこいじゃぞ～！","0"
"599483","0","1","2","0","0","763","0","0","1","1","1","0","0","0","0","0","0","False","False","False","シュコォ……シュコォ……<hex:02100103>ゴブの野営地　すっかり安全　大感謝～！","毒まき娘　二度と立ち入り　許さな～い！<hex:02100103>とてとて強力　ゴブ爆弾で　海の彼方へ　吹っ飛ば～す！","0"
"599482","0","1","2","0","0","1041","755","0","1","1","1","0","0","0","0","0","0","False","False","False","よう、お前か。<hex:02100103>その後、エルレットたちを見かけたって情報は入ってないぞ。","ブレイフロクスの爆弾でどこまで吹っ飛んだかわからねぇが……<hex:02100103>ま、ひとまずのところは一件落着ってことでいいだろう。<hex:02100103>もし見つけたら、黒渦団に突き出しておくさ。","0"
"599485","0","1","2","0","0","950","0","1023","1","1","1","0","0","0","0","0","0","False","False","False","おう、おう、<hex:022C0DFF07022903EB0203FF02200203>！<hex:02100103>最近はよ、どんな怪魚でも売れるってんで、<hex:02100103>仕入れ先の漁師たちが以前にも増して協力的でな。","今日も見たことねぇ魚が入ってきてるよ。<hex:02100103>店に出せるように、パシェニネを見習って味見してみねぇと！","やっこさんも、ワラキ族の里で元気にしてると思うぜ！<hex:02100103>便りがないのはいい便りってな！　ガッハッハッ！"
"599484","0","1","2","0","0","764","0","0","1","1","1","0","0","0","0","0","0","False","False","False","みなさんがまだ着いてないので、待ちましょう……。","0","0"
"599487","0","1","0","2","0","0","762","0","1","1","1","0","0","0","0","0","0","False","False","False","東方の海の色とはまた違う、すごく綺麗な青い海～！<hex:02100103>泳いでみたいなあ～……。","あっ……ごめんなさい、気づかなくて！<hex:02100103>降神祭の催しへの参加は、まずは姉様……じゃなくて、<hex:02100103>巳奉行様にお声がけくださいねっ！","0"
"599486","0","1","2","0","0","5695","0","5734","1","1","1","0","0","0","0","0","0","False","False","False","問答巡りは、もともと東方の修験者たちが、<hex:02100103>世の理を知るために行っていた修行のひとつ。","辛く長い旅を経て、各地の神仙と問答を重ねることで、<hex:02100103>己を高める術としていたそうです。","斯様な見識を深めるための道は、すべての人に開かれるべきもの。<hex:02100103>僭越ながらこの催しで、その機会に触れていただけたなら、<hex:02100103>私も海の向こうから来た甲斐がございますわ。"
"599473","0","1","2","0","0","764","0","0","1","1","1","0","0","0","0","0","0","False","False","False","グレノルトさんの準備ができ次第、私たちも向かいますっ！<hex:02100103>「エクセドラ大広場」で合流しましょう！","0","0"
"599472","0","1","2","0","0","5696","0","0","1","1","1","0","0","0","0","0","0","False","False","False","サリャク様の像と、この海を眺めていると、<hex:02100103>神話学研究で凝り固まった頭がリフレッシュできるんです。<hex:02100103>研究者も少しは外に出ないといけませんね。","0","0"
"599475","0","1","2","0","0","764","0","0","1","1","1","0","0","0","0","0","0","False","False","False","<hex:022C0DFF07022903EB0203FF02200203>殿なしに、<hex:02100103>この高みへは至れなかったであろう。<hex:02100103>深く感謝申し上げたい。","0","0"
"599474","0","1","2","0","0","9003","0","0","1","1","1","0","0","0","0","0","0","False","False","False","ふぅぅ～、感無量ですっ……！","0","0"
"599477","0","1","2","0","0","764","0","0","1","1","1","0","0","0","0","0","0","False","False","False","<hex:022C0DFF07022903EB0203FF02200203>、<hex:02100103>ローシュカナと祭器のことを、どうかよろしく頼むよ。","0","0"
"599476","0","1","2","0","0","763","0","0","1","1","1","0","0","0","0","0","0","False","False","False","リムサ・ロミンサの港で働いている、<hex:02100103>「バルドブリダ」というゼーヴォルフ族の女性を探してみてくれ。<hex:02100103>彼女なら、ローシュカナの行方を知っているかもしれない。","0","0"
"599479","0","1","1","1","0","755","755","0","1","1","1","0","0","0","0","0","0","False","False","False","ああ、<hex:022C0DFF07022903EB0203FF02200203>さん。<hex:02100103>僕もあなたぐらい、優秀な癒やし手だったらよかったんだが……。","まあ、ないものねだりをしても仕方ないか。<hex:02100103>体を休めたら、また腕を磨いていくさ。","0"
"599478","0","1","1","0","0","755","0","0","1","1","1","0","0","0","0","0","0","False","False","False","長距離を全速力で走るのはきつかったぜ……。<hex:02100103>もっと体を鍛えねぇとなぁ。","0","0"
"599497","0","1","2","0","0","767","0","0","1","1","1","0","0","0","0","0","0","False","False","False","さっそく見ていってよ、自慢の商品を！<hex:02100103>魔物に襲われることもすっかりなくなったから、<hex:02100103>稀少な品も、取り扱ってみることにしたんだ！","0","0"
"599496","0","1","2","0","0","767","0","0","1","1","1","0","0","0","0","0","0","False","False","False","さっそく見ていってよ、自慢の商品を！<hex:02100103>最近、魔物に襲われずに済む仕入れ経路を見つけてね、<hex:02100103>品数を増やしてみたんだ！","0","0"
"599499","0","1","2","0","0","767","0","0","1","1","1","0","0","0","0","0","0","False","False","False","ようこそ、ようこそ、旅のお方！<hex:02100103>大嵐の影響で閉じていたお店を再開したから、<hex:02100103>よければ「バイカラージェム」で取引していってね。","0","0"
"599498","0","1","2","0","0","767","0","0","1","1","1","0","0","0","0","7","0","False","False","False","ごめんね、ごめんね、今は取引ができないのよ。<hex:02100103>商品を保管していた倉庫が、大嵐でめちゃくちゃに……<hex:02100103>まったく困っちゃったわ。","この広域交易商と取引するには、<hex:02100103>「メインクエスト：黄金のレガシー」を、<hex:02100103>特定の状態まで完了する必要があります。","0"
"599501","0","1","2","0","0","767","0","0","1","1","1","0","0","0","0","0","0","False","False","False","さあ、さあ、何か欲しいものはある？<hex:02100103>段々と商品も増やしているから、<hex:02100103>あなた好みのものが見つかるといいんだけど。","0","0"
"599500","0","1","2","0","0","767","0","0","1","1","1","0","0","0","0","0","0","False","False","False","さあ、さあ、何か欲しいものはある？<hex:02100103>このあたりは危険な野生生物が多いから、<hex:02100103>用意できた商品が少ないのは、大目に見てね。","0","0"
"599503","0","1","2","0","0","767","0","0","1","1","1","0","0","0","0","0","0","False","False","False","さあ、さあ、何か欲しいものはある？<hex:02100103>旅の方が、このあたりの危険を排除してくれたんでしょう？<hex:02100103>そのお礼も兼ねて、特別な商品も用意してみたわ！","0","0"
"599502","0","1","2","0","0","767","0","0","1","1","1","0","0","0","0","0","0","False","False","False","さあ、さあ、何か欲しいものはある？<hex:02100103>危険な野生生物を旅の方が倒してくれたみたいで、<hex:02100103>調達できる品物がずいぶん増えたのよ！","0","0"
"599489","0","1","0","2","0","0","1071","0","1","1","1","0","0","0","0","0","0","False","False","False","ちくしょ～、腹減ってきたぜ……。<hex:02100103>当番が終わったら、絶対に姉ちゃんたちとみんなで、<hex:02100103>この街の美味い店巡りするんだ……！","おっ、降神祭の催しの参加希望者か？<hex:02100103>だったらまずは、アフトカースルってところに戻って、<hex:02100103>姉ちゃ……巳奉行様に話を聞いてきてくれ！","0"
"599488","0","1","0","1","2","0","4218","933","1","1","1","0","604","0","0","0","0","False","False","False","ふんふふ、ふふ～……。","……わぁ、ごめんねぇ。<hex:02100103>人が多すぎて、ぼーっとしちゃってたみたい～。","降神祭の催しに参加したいのぉ？<hex:02100103>じゃあねぇ、まずは巳奉行お姉さまのところに行って、<hex:02100103>説明を受けてきてね～。"
"599491","0","1","2","0","0","764","0","0","1","1","1","0","0","0","0","0","0","False","False","False","おう、おう、うちは魚屋だ！<hex:02100103>どれも新鮮なのを仕入れてるから見ていってな！","0","0"
"599490","0","1","2","0","0","763","0","5734","1","1","1","0","0","0","0","0","0","False","False","False","それにしても、本物の白ツチノコ様は、<hex:02100103>伝承の巻物に描かれてきたお姿そのままで、<hex:02100103>安心いたしました。","伝わっていたのは、鏡餅に通ずるずんぐり丸い姿ということのみ。<hex:02100103>人前に現れることのなかった数百年の間に、<hex:02100103>図画が異なる形に変遷していても、おかしくはありませんから。","つまりは白ツチノコ様の伝承を継いできた数多の者たちが、<hex:02100103>大切に、正しく語ってきたとの証明に他なりません。<hex:02100103>こたび景品としても、そのお姿を広めることができ何よりです！"
"599493","0","1","2","0","0","767","0","0","1","1","1","0","0","0","0","0","0","False","False","False","よく来たね、僕のお店に！<hex:02100103>うちは「ペル」でも「ギル」でもなくて、<hex:02100103>新たな試みとして「バイカラージェム」で取引してるよ！","0","0"
"599492","0","1","2","0","0","767","0","0","1","1","1","0","0","0","0","7","0","False","False","False","申し訳ないけど休業中なんだ、僕のお店は。<hex:02100103>商品を運んでたら魔物に襲われて、荷物は全滅……<hex:02100103>仕入れなおす算段をたててるから、また来てよ！","この広域交易商と取引するには、<hex:02100103>「メインクエスト：黄金のレガシー」を、<hex:02100103>特定の状態まで完了する必要があります。","0"
"599495","0","1","2","0","0","767","0","0","1","1","1","0","0","0","0","0","0","False","False","False","さっそく見ていってよ、自慢の商品を！<hex:02100103>このところ魔物に襲われることが減ってきたのでね。<hex:02100103>ちょっとだけ、仕入れ数を増やしてみたんだ！","0","0"
"599494","0","1","2","0","0","767","0","0","1","1","1","0","0","0","0","0","0","False","False","False","さっそく見ていってよ、自慢の商品を！<hex:02100103>運送中に魔物が襲ってきても痛手にならないように、<hex:02100103>仕入れてきた品数は、少なめだけどね。","0","0"
"599513","0","1","2","0","0","767","0","0","1","1","1","0","0","0","0","0","0","False","False","False","そんなに多くはない品数だけど、売り物はこんな感じだよ。<hex:02100103>このあたりで調達できるものをいくつか増やしたから、<hex:02100103>お前さんの欲しい物が見つかると嬉しいよ。","0","0"
"599512","0","1","2","0","0","767","0","0","1","1","1","0","0","0","0","0","0","False","False","False","ちょっと心許ない品数だけど、売り物はこんな感じだよ。<hex:02100103>道の近くまで魔物が近づいてくるもんだから、<hex:02100103>商品を運ぶのもひと苦労なんだよね。","0","0"
"599515","0","1","2","0","0","767","0","0","1","1","1","0","0","0","0","0","0","False","False","False","売り物は潤沢に取り揃えてるよ！<hex:02100103>ここいらもすっかり魔物が大人しくなったもんで、<hex:02100103>滅多にお目にかかれない、希少品なんかも仕入れてみたんだ。","0","0"
"599514","0","1","2","0","0","767","0","0","1","1","1","0","0","0","0","0","0","False","False","False","今の売り物はこんな感じだよ。<hex:02100103>腕の立つヤツが魔物を倒してくれてるようでさ、<hex:02100103>道が安全なうちに、いろいろ調達してきたんだ。","0","0"
"599517","0","1","2","0","0","767","0","0","1","1","1","0","0","0","0","0","0","False","False","False","いいところに来たね。<hex:02100103>拾得人がいくつか商品を提供してくれたから、<hex:02100103>欲しいものがあれば、「バイカラージェム」と交換しよう。","0","0"
"599516","0","1","2","0","0","767","0","0","1","1","1","0","0","0","0","7","0","False","False","False","やあ、こんにちは。<hex:02100103>ここでは、リサイクルに出さない品を取り扱っているんだけど、<hex:02100103>今は在庫がなくてね……また顔を出してくれたら嬉しいよ。","この広域交易商と取引するには、<hex:02100103>「メインクエスト：黄金のレガシー」を、<hex:02100103>特定の状態まで完了する必要があります。","0"
"599519","0","1","2","0","0","767","0","0","1","1","1","0","0","0","0","0","0","False","False","False","さて、気になる品はあるかな？<hex:02100103>拾得人がちょっと多めに商品を持ってきてくれてね、<hex:02100103>少し品数が増えたから、見ていってよ。","0","0"
"599518","0","1","2","0","0","767","0","0","1","1","1","0","0","0","0","0","0","False","False","False","さて、気になる品はあるかな？<hex:02100103>ただ、魔物の妨害で拾得人も仕事をしづらいみたいでね、<hex:02100103>品数が少ないのは、目を瞑ってもらえると助かるよ。","0","0"
"599505","0","1","2","0","0","767","0","0","1","1","1","0","0","0","0","0","0","False","False","False","なんだ、何か入用か？<hex:02100103>ちょうど商品を仕入れたところでな、<hex:02100103>アンタさえよけりゃあ「バイカラージェム」で取引といこう。","0","0"
"599504","0","1","2","0","0","767","0","0","1","1","1","0","0","0","0","7","0","False","False","False","アンタと取引をしたいところだが、あいにくと今は閉店中だ。<hex:02100103>知ってのとおり、しばらく気球が止まっていたから、<hex:02100103>商品の用意がなくてな……また頼むよ。","この広域交易商と取引するには、<hex:02100103>「メインクエスト：黄金のレガシー」を、<hex:02100103>特定の状態まで完了する必要があります。","0"
"599507","0","1","2","0","0","767","0","0","1","1","1","0","0","0","0","0","0","False","False","False","店の在庫はボチボチってところか。<hex:02100103>獣による被害のせいで、商品の調達に手間取ってるが、<hex:02100103>いくつか新しい品を見繕ってみたぞ。","0","0"
"599506","0","1","2","0","0","767","0","0","1","1","1","0","0","0","0","0","0","False","False","False","今のところ、店の在庫は品薄だ。<hex:02100103>森の獣を狩る人手が足りてなくてよ、<hex:02100103>移動するのが危険で、商品の仕入れが滞ってるんだ。","0","0"
"599509","0","1","2","0","0","767","0","0","1","1","1","0","0","0","0","0","0","False","False","False","店の在庫は申し分がないぐらいにあるぞ。<hex:02100103>アンタの興味を引けそうな珍しい品も入ってるから、<hex:02100103>じっくり見ていってくれよ。","0","0"
"599508","0","1","2","0","0","767","0","0","1","1","1","0","0","0","0","0","0","False","False","False","店の在庫も開店当初より増えてきたんだよ。<hex:02100103>森の獣が狩られて、移動も楽になったんでな、<hex:02100103>商品も取り揃えやすくなってきたってわけだ。","0","0"
"599511","0","1","2","0","0","767","0","0","1","1","1","0","0","0","0","0","0","False","False","False","何か欲しいものでもあるのかい？<hex:02100103>それなら、ここの特産品をいくつか仕入れてあるから、<hex:02100103>あたしと「バイカラージェム」で取引していってよ。","0","0"
"599510","0","1","2","0","0","767","0","0","1","1","1","0","0","0","0","7","0","False","False","False","あたしは行商人なんだけど、<hex:02100103>しばらくはここに滞在しようと思っててね。<hex:02100103>商品を見繕ってるところだから、そのうち取引しに来ておくれ。","この広域交易商と取引するには、<hex:02100103>「メインクエスト：黄金のレガシー」を、<hex:02100103>特定の状態まで完了する必要があります。","0"
"599529","0","1","2","0","0","767","0","0","1","1","1","0","0","0","0","0","0","False","False","False","おう、声かけてくれたところすまねぇが、<hex:02100103>ここの店はまだ準備中でな。<hex:02100103>開店したらまた来てくれや。","0","0"
"599528","0","1","0","0","0","0","0","0","1","1","1","0","0","0","7","7","0","False","False","False","このエリアの広域交易商と取引可能になりました！<hex:02100103>「バイカラージェム」と引き換えに、様々な品を入手できます。","なお、広域交易商が取り扱う商品の品揃えは、<hex:02100103>該当エリアのF.A.T.E.達成回数に応じて、増えていきます。<hex:02100103>積極的に、F.A.T.E.に挑戦してみましょう。","0"
"599531","0","1","2","0","0","767","0","0","1","1","1","0","0","0","0","7","0","False","False","False","おう、声かけてくれたところすまねぇが、<hex:02100103>ここの店はまだ準備中でな。<hex:02100103>開店したらまた来てくれや。","オルコ・パチャ、コザマル・カ、ヤクテル樹海、シャーローニ荒野、<hex:02100103>ヘリテージファウンド、リビング・メモリーにて、<hex:02100103>F.A.T.E.達成度がRANK4になると、取引可能となります。","0"
"599530","0","1","2","0","0","767","0","0","1","1","1","0","0","0","0","7","0","False","False","False","おう、声かけてくれたところすまねぇが、<hex:02100103>ここの店はまだ準備中でな。<hex:02100103>開店したらまた来てくれや。","この広域交易商と取引するには、<hex:02100103>「メインクエスト：黄金のレガシー」を、<hex:02100103>特定の状態まで完了する必要があります。","0"
"599533","0","1","2","0","0","767","0","0","1","1","1","0","0","0","0","0","0","False","False","False","よく来たな、お客人。<hex:02100103>各地からいいモンを仕入れてあるぜ。","0","0"
"599532","0","1","2","0","0","767","0","0","1","1","1","0","0","0","0","0","0","False","False","False","よく来たな、お客人。<hex:02100103>各地からいいモンを仕入れたんでな、<hex:02100103>よけりゃあ「バイカラージェム」と交換していってくれや。","0","0"
"599535","0","1","2","0","0","767","0","0","1","1","1","0","0","0","0","7","0","False","False","False","せっかく立ち寄ってくれたのに、ごめんなさいねぇ！<hex:02100103>配達人がドジって商品が届いてないから、<hex:02100103>悪いんだけど出直してちょうだいな！","この広域交易商と取引するには、<hex:02100103>「メインクエスト：黄金のレガシー」を、<hex:02100103>特定の状態まで完了する必要があります。","0"
"599534","0","1","2","0","0","767","0","0","1","1","1","0","0","0","0","0","0","False","False","False","せっかく立ち寄ってくれたのに、ごめんなさいねぇ！<hex:02100103>配達人がドジって商品が届いてないから、<hex:02100103>悪いんだけど出直してちょうだいな！","0","0"
"599521","0","1","2","0","0","767","0","0","1","1","1","0","0","0","0","0","0","False","False","False","さて、気になる品はあるかな？<hex:02100103>安全に仕事ができたとかで、拾得人たちが上機嫌でね、<hex:02100103>掘り出し物も商品として提供してくれたんだよ。","0","0"
"599520","0","1","2","0","0","767","0","0","1","1","1","0","0","0","0","0","0","False","False","False","さて、気になる品はあるかな？<hex:02100103>近頃は、魔物に仕事を邪魔されることもないようでね、<hex:02100103>拾得人が大量に商品を置いていってくれたんだよ。","0","0"
"599523","0","1","2","0","0","767","0","0","1","1","1","0","0","0","11","0","0","False","False","False","リビング・メモリーへようこそ。<hex:02100103>こちらの窓口ではご来訪のお客様向けに、<hex:02100103>「バイカラージェム」と景品の交換をおこなっております。","0","0"
"599522","0","1","2","0","0","767","0","0","1","1","1","0","0","0","11","7","0","False","False","False","現在、こちらの窓口では受付を停止しております。<hex:02100103>お客様には大変ご迷惑をおかけいたしますが、<hex:02100103>何卒ご了承ください。","この広域交易商と取引するには、<hex:02100103>「メインクエスト：黄金のレガシー」を、<hex:02100103>特定の状態まで完了する必要があります。","0"
"599525","0","1","2","0","0","767","0","0","1","1","1","0","0","0","11","0","0","False","False","False","交換できる景品はこちらです。<hex:02100103>当施設の安全維持に貢献してくださったので、<hex:02100103>ラインナップを増加させております。","0","0"
